address1,city,zip,subDivision,state,beds,baths,full_baths,half_baths,price,lotSizeSqFt,sqft,yearBuilt,dateAdded,description
8014 15A Avenue,Edmonton,T5K 4E3,Satoo,AB,4,3,3,-1,"$369,995",4069.72,1583,1993,10/8/2021,"PERFECTLY LOCATED! OVER 1580 SQ.FT. + DEVELOPED BASEMENT - When you think starter home, you think small and basic, but this home is anything but that! In fact, this home is the complete opposite. With well over 1500 sq ft of living space, spread over four different levels, this home is LARGE. Come in the front door & you will be greeted with a spacious landing & living room, with natural light flooding in through the many windows! The kitchen is spacious & has lots of cabinets and cupboards. Next up to the bedrooms, 2 good sized rooms & a 4-piece bathroom with a nice sized primary bedroom. Go downstairs to the lower family room. Then there is the location walking distance to Satoo Park & Dan Knott School even the NEW LRT TRANSIT LINE. There's so much value & opportunity, including new appliances & a new HWT! This is a home where you can start a family, raise a family & retire in without ever breaking the bank & do it in a wonderful & mature community. Welcome home!"
11344 62 Street,Edmonton,T5W 4C1,Highlands,AB,2,2,1,1,"$435,000",8578.51,1245,1946,10/8/2021,"A prime 66x130 landscaped corner lot is lush w/ mature trees & offers distinguished curb appeal w/ feat. such as a projecting gable roof supported by stone pilasters w/ flush eaves & concrete construction created to look like stone, this one-of-a-kind home will charm the most discerning Buyer. Intrigue sparks inside w/ spaces crafted by a refined & practical floor plan, beginning w/ a LR boasting a wood burning F/P, creating a cozy ambiance. The formal DR dazzles w/ gleaming refinished original hrdwd floors & is adj. to the classic & cozy eat-in kitchen that offers vintage white cabinetry & windows overlooking the extra large sunny west backyard. Upstairs, you will discover 2 spacious bdrms, w/ charming details such as built-in dressers & gleaming hrdwd floors. The bsmt keeps family recreation in mind, offering a spacious rec room, 3rd bdrm, workshop, & laundry.  Newly revitalized, Highlands offers parks, pathways & schools & is within walking distance of amenities such as Fox Burger, Kind Ice Cream, etc."
11920 70 Street,Edmonton,T5B 1T9,Montrose (Edmonton),AB,3,1,1,-1,"$209,900",4156.48,950,1959,10/8/2021,"30x126 foot lot on Montrose with a great family home. This home has new windows, furnace, and shingles, and offers 3 bedrooms on the main floor, full bathroom, a spacious living room, functional kitchen and dining area. The basement is partially finished and needs flooring to complete. With a small amount of work, you can add 1 or 2 bedrooms downstairs quite easily. The yard is very large and has plenty of room to add a double garage with room to spare. Quiet street, close to amenities and transportation routes. Great property for a young family, or your next investment."
31 Pine Street,Sherwood Park,T8A 1G4,Sherwood Heights,AB,5,2,2,-1,"$349,900",8761.81,1081,1961,10/8/2021,"MASSIVE LOT with south facing backyard..! In neighborhood of Sherwood Heights. This updated bungalow offers 5 bedrooms (3 on main floor, 2 in basement) and two bathrooms. Featured with hardwood floors, spacious living area, renovated kitchen, all new main floor windows, fully finished basement with wood burning fire place, lots of matured trees and shed in the back yard. This home has newly upgraded high efficiency furnace, hot water tanks and upgraded R40 insulation in attic and lots of other upgrades. Walking distance to schools, parks, Sherwood park mall. More photos coming soon."
6405 45 Street,Cold Lake,T9M 0B5,Tri City Estates,AB,4,3,3,-1,"$419,900",-1.0,1380,2014,10/8/2021,"Comfort and class! 4 bedroom, 3 bathroom raised bungalow featuring an open concept living room, dining room and kitchen with stainless steel appliances including induction stove. Large 12x17 sq. ft deck has natural gas BBQ hookup and overlooks a huge fenced yard backing onto a farmers field=no neighbors behind! Master suite boasts spacious 5 pc en-suite with separate shower, soaker tub, double sinks and a pretty sliding barn door. Very convenient main floor laundry. Fully finished basement has a stunning bar counter and large family room and rec area, perfect for movie nights and entertaining! Central air conditioning, blackout blinds, large storage spaces, ICF foundation and a double, heated, attached garage. All in a great neighborhood, with easy access to Hwy 28, 4 Wing, Cold Lake and downtown Cold Lake. Find your new home here!"
10540 60A Avenue,Edmonton,T6H 1K3,Pleasantview (Edmonton),AB,5,2,2,-1,"$448,800",5728.98,1169,1963,10/8/2021,"Welcome to Pleasantview! This south facing, bungalow with many upgrades and tons of natural light is a perfect starter home or an amazing investment opportunity. With a bus stop just a few steps away, this house is ideal for anyone wanting the convenience of transit. With cottage like curb appeal, this charming and well maintained 1150sq ft fully finished bungalow offers 3+2 bedrooms, 2 full baths and a double detached garage! Plus separate basement entrance from the back, consisting of the 2 bedrooms, 1 - 3pc bath and a second kitchen, this can be easily used as a mortgage helper. A space perfect for young professionals or University students. Double detached garage, fully landscaped, fully fenced, this revenue property is ready for a new owner. Close to major bus routes, Amenities and Whyte avenue. Do not miss this amazing opportunity!"
 Address Withheld,Rural Strathcona County,T8E 1B2,Dixon Place,AB,3,3,3,-1,"$630,000",-1.0,1661,2003,10/8/2021,*Please note* property is sold  as is where is at time of possession . No warranties or representations Please note 2 double detached garages (oversized)
8303 157 Avenue,Edmonton,T5Z 2P8,Belle Rive,AB,3,2,2,-1,"$294,900",3421.84,1039,1982,10/8/2021,"Great bungalow family home on the corner of a cul-de-sac! This 2 bedroom up + 1 bedroom down home has been updated and boasts a nice living room with bright windows, gas fireplace & ceiling fan. Kitchen has TONS of storage & lots of counterspace with free-standing island & pantry. Black appliances w/ gas stove are great for the aspiring chef! Down the hall, you'll find a Nest thermostat, the Primary bedroom with a HUGE walk-in-closet, the 2nd bedroom and beautifully renovated 4pc bath with wall to ceiling tile, granite top & over-the-counter vessel sink. Downstairs is a large rec room to play, dry bar to entertain and 3rd bedroom to relax in & full 4pc bath. Laundry next to tub sink make cleaning easier! Outdoors is the SOUTH facing yard with vegetable garden in raised planting beds, storage sheds & low-maintenance yard with nice raised deck patio. Close to Belle Rive Park and surrounded by beautiful mature trees!"
339 Griesbach School Road,Edmonton,T5E 6N1,Griesbach,AB,3,4,3,1,"$349,900",3201.51,1200,2006,10/8/2021,"Quietly nestled in the urban village of Griesbach this well appointed half duplex home will not disappoint. In the ideal location you are just steps away from the incredible array of neighbourhood amenities such as the community gardens, tobogganing hill, walking trails, shopping complex, Major General Griesbach School & public transit. Boasting over 1736 SQFT of developed living space, this home includes 3 bedrooms, 4 bathroom, a professionally finished basement & an insulated double detached garage. Upgrades not to be missed include new air-conditioning, furnace & HWT. Upon entering, you will be greeted with features such as gleaming hardwood floors, custom insulative cellular blinds & fresh paint throughout. Cook's kitchen showcases a large centre island with eating bar, maple cabinetry & stainless steel appliance + a new bosch dishwasher. The backyard is the ideal space to unwind and enjoy the many garden beds of fruits and vegetables. This home is in pristine condition and is turn key ready for you!"
56 Grandora Crescent,St. Albert,T8N 0V1,Grandin,AB,3,1,1,-1,"$289,900",7631.61,958,1961,10/8/2021,"Location, location, location! Opportunity on quiet Grandora Crescent close to everything you could need. This home has been loved by the same owners for 50 years and it is time for a new family. The bungalow has refinish-able oak hardwood, 3 bedrooms (2+1), a finished basement with retro family room plus a den and the 3rd bedroom, a huge west facing backyard with mature trees and an oversized single garage. Schools, parks, transit and shopping nearby with quick access to the city and Henday."
2006 55 Street,Edmonton,T6L 3E6,Meyokumin,AB,5,2,2,-1,"$264,900",4013.64,1189,1982,10/8/2021,"Welcome to this fantastic half duplex. This home offers ample living space with a total of 5 bedrooms. The main floor offers a large living room, a kitchen with ample cabinet and counter top space and a great size nook. # bedrooms on the upper floor and a full washroom. SEPRATE ENTRANCE to the basement. The basement has a large living room with 2 bedrooms, a full washroom and A SECOND KITCHEN!. Close to schools, shopping and public transportation. Make this home yours!"
16437 105A Avenue,Edmonton,T5P 0V6,Britannia Youngstown,AB,4,2,2,-1,"$309,649",5498.85,1089,1958,10/8/2021,"Great 1087sqft bungalow with natural gleaming floors. # bedroom converted into to and a den easily converted back to 3. This home features many upgrades Newer windows throughout, Furnace 2012, hot water heater 2015, Roof 2011, insulation in attic 2020. Basement is open with 1 bedroom second kitchen 3pce bathroom and storage. There is a beautiful south back yard with newer over sized dble garage. Located on quiet street."
135 Galloway Wynd,Fort Saskatchewan,T8L 0B9,South Fort,AB,3,2,1,1,"$295,500",3686.96,1095,2007,10/8/2021,"This gorgeous 1,095 square foot 3 bedroom half duplex is located in the heart of South Fort in Fort Saskatchewan. The main floor features an open concept floor plan with large U shaped kitchen, spacious living room with corner tile surrounded natural gas fireplace, and great sized dining area. The upper level is completed with a huge primary bedroom with walk in closet, a 4 piece bathroom, and 2 additional generous kids bedrooms. The fully finished basement is where you will find a large rec room perfect for family entertainment, storage, and laundry area. This home also boasts a massive yard with stone feature fence. Located close to schools, the DCC, shopping, and all major amenities."
87 Joyal Way,St. Albert,T8N 7V5,Jensen Lakes,AB,3,3,2,1,"$399,900",3196.88,1530,2018,10/8/2021,"Enjoy BEACH ACCESS, walking trails, shopping nearby, 2 BRAND NEW SCHOOLS, and more that Jensen Lakes has to offer! And NO CONDO FEES! This Daytona-built 1,529 square foot 2-storey has its own attached DOUBLE TANDEM GARAGE! The open concept main floor boasts large east-facing windows in the living room. The island kitchen features gleaming STAINLESS STEEL APPLIANCES, quartz counters, a breakfast bar, and a large pantry! Off the dining area you'll find a 2-piece guest bath and a garden door out to the deck. Heading upstairs, the primary bedroom features a walk-through closet and 3-PIECE ENSUITE. Here there are two more bedrooms, plus the main 4-piece bath, and CONVENIENT UPSTAIRS LAUNDRY! Lots to love in Jensen Lakes!"
11215 65 Street,Edmonton,T5W 4K4,Highlands,AB,3,3,2,1,"$584,900",4397.05,1564,1920,10/8/2021,"Your best life begins with a home that inspires you. The original Highlands showhome built in 1912 was completely restored as a labor of love, maintaining it's original charm and character, yet enhancing it's quality to today's standards. The main floor features 9 foot ceilings with a comfortable living space, large windows, original hardwood floors, and a charming new kitchen and bathroom. Upstairs you'll find 3 bedrooms plus a full bathroom with clawfoot tub. The rear bedroom features a beautiful veranda plus twin patios overlooking the beautiful backyard garden, which features a pond, all new sidewalks, and plants that were strategic and professionally designed to bloom from spring, right through to the end of fall so you'll always have color. The basement is fully finished with a 3rd bathroom plus new furnace, all new plumbing with double manifold system, and electrical. Other updates include roof, insulation, double garage and pad plus so much more. A rare gem that must be seen to truly appreciate."
19350 Township Road 484,Rural Camrose County,T0B 2M2,None,AB,4,2,2,-1,"$429,900",-1.0,1747,1978,10/8/2021,"Welcome to 19350 Township Road 484 in Camrose County! 4 bedroom, 2 bathroom bungalow with 32' x 40' shop on 18.35 acres. Private setting with green space, pasture, mature trees, and ponds. Great horse setup with x-fencing, barn, stock waterer, and round pen. Open concept design of living room with gas fireplace, dinette with access to the back deck, and kitchen with tiered island. Huge bonus room in the lower level with access to outside. Primary bedroom with 4pc ensuite, 2nd & 3rd bedrooms, and 4pc main bathroom completes the main floor of this lovely home. Basement is partially finished with family room, bedroom, 3pc bathroom rough-in, and laundry/utility room. Front and back decks are perfect for observing the abundance of wildlife and waterfowl. All this is only 20 minutes from Camrose and 45 minutes to the outskirts of Edmonton & Sherwood Park. Come experience the pride of ownership this acreage has to offer!"
3144 49A Street,Edmonton,T6L 4Y6,Weinlos,AB,5,2,1,1,"$335,000",5481.84,914,1987,10/8/2021,"If you want space for your growing family as well as a good solid home, then look no FURTHER! You've found it here. Welcome home to your beautiful 5 Bedroom, 4 level split home located in the heart of Mill Woods. This is a no pet and smoke free home, so everyone is welcome! Inside you'll find beautiful laminate floors on all levels and tile in the bathrooms. There are 2 bedrooms on the top floor, 2 on the middle floor, and 1 in the basement. You are very close to shopping, recreations centers, school, public transportation and so much more. Easy access to the Whitemud and Anthony Henday, so your commute will never be an issue. This home is also close to hiking trails outside the city and so much more. This home will not disappoint. It's been very well maintained and looked after, and is looking for a new family to call it home."
52 Kensington Close,Spruce Grove,T7X 0S9,Kenton,AB,3,3,2,1,"$515,000",5360.42,2057,2015,10/8/2021,"For more information, see Realtor Website.  Motivated seller. 2015 Sanrufo built 3 bedrooms plus a main floor den home. Open concept with 9 foot ceilings and engineered hardwood floor on entire main floor. Numerous upgrades including appliances, granite counter tops throughout and large kitchen island with eating bar. Upper level bright laundry with a sink. Backing on to walking trails and a green space."
 Address Withheld,Edmonton,T6W 2L7,Windermere,AB,4,4,3,1,"$414,800",3387.18,1467,2014,10/8/2021,"A GREAT find just minutes from all amenities! This 1466 sq ft duplex in the desired neighbourhood of Windermere features 3 + 1 bedrooms, 3.5 baths, FULLY FINISHED BASEMENT and double attached garage! The main floor offers a spacious front foyer leading into open-concept kitchen, dining area and living room overlooking the east facing deck, fully fenced and landscaped yard! On the second floor you'll find three large bedrooms, 4pce ensuite, full 4pc family bathroom and laundry. The FULLY FINISHED basement features large family room, bedroom and 3 pce bath. Upgrades include new paint on the main and upper floors, as well as new carpet on the stairs and upper floor! Enjoy the gazebo featured in the backyard, as it is being left for you by the sellers! Perfect for families! Welcome Home!!"
15833 94A Avenue,Edmonton,T5R 5L9,Meadowlark Park (Edmonton),AB,4,2,2,-1,"$358,000",6115.4,1113,1958,10/8/2021,"Welcome to well established community of Meadowlark Park! This bright 1927 sqft 4 bedrooms plus den bungalow features an oversized detached double garage and massive driveway for RV parking. Fenced back yard with great landscape patio and mature trees. Hardwood throughout main floor & no carpet. The dinning room connects with the well designed cabinet-rich kitchen with a side walk in pantry overlooking SUNNY SOUTH facing private backyard. Three bay windows one each in huge cozy living room, dinning room & one bedroom! 3 generous sized bedrooms at main & 4 pcs main bathroom are ready to accommodate. Add it into the fully finished basement with its huge family room with FIREPLACE plus one bedroom, one den, 3 pc bathroom & laundry/workshop/storage. This property is within walking distance to schools, playgrounds, shopping and future LRT. Over the years the shingles have been replaced as well as Water Tank and Furnace and most windows. New paint, new mirror closets and well maintained. Ready to move in now!"
25 51561 Rge Rd 225 A,Rural Strathcona County,T8C 1H5,Doru Road,AB,5,4,3,1,"$749,702",-1.0,1836,1976,10/8/2021,"AMAZING LOCATION...PRIVATE AND TREED...HEATED OVERSIZED DOUBLE ATTACHED GARAGE...Upgraded walkout bungalow nestled on 10 acres of trees and corrals. Large country island kitchen with plenty of counter and cabinets. 2 dining areas. Main floor living and family room both enjoy gorgeous brick wood burning fireplace stunning views and wrap around deck. Gorgeous hardwood throughout.  Kingsized primary bedroom walks onto deck has plenty of closet space and full ensuite. 2 additional bdms, newly renovated 4 pc bathroom with beautiful tile work plus added 2 pc bath in the mud room complete main floor. Professionally finished walkout with family room enjoying cozy brick f/p, exercise room, 3 additional bedrooms, bath and laundry. Newer windows, furnace, roof, septic system and much more. Oversized dbl att garage has 220, plus a 30' x 36\u0022 POLE SHED accommodate RV's PLUS large parking pad for trailers. Barn and corrals for horses. Great Property located within Minutes of Sherwood Park and Edmonton."
15702 86 Avenue,Edmonton,T5R 4C4,Lynnwood,AB,5,4,4,-1,"$695,000",6335.63,1783,1959,10/8/2021,"You don't want to miss this gem located in the desirable and mature neighborhood of Lynnwood! This custom built, 2 story home COMPLETELY RENOVATED FROM TOP TO BOTTOM WITH UPGRADES THROUGHOUT: Wide open layout WITH NEW APPLIANCES, NEW HARDWOOD FLOORS, NEW CABINETS,  LINEAR GAS FIRE PLACE, NEW 2-TONE GRANITE COUNTERS,  GAS COOKTOP ON THE ISLAND, NEW OAK MILLWORK DETAILS, COFFERED CEILINGS, NEW WASHROOMS, NEW VANITIES, MASTER SUITE WITH CUSTOM TILED ENSUITE SHOWER, DOUBLE VANITIES, WALK-IN CLOSET.  On the main you will find a family room/bedroom, and a bright 3 piece bath. Head up the stairs and 2 large bedrooms await you.  The basement features a FULLY PERMITTED SECONDARY SUITE. PERFECT as a MORTGAGE HELPER rented at $1500 a month with 2 bedrooms and a full 3 piece bathroom. Parking is a breeze with your HEATED GARAGE at the front of the lot."
5928 208 Street,Edmonton,T6M 0M1,The Hamptons,AB,4,3,2,1,"$599,900",5898.83,2450,2010,10/8/2021,"Absolutely stunning 4 bedroom home on a huge lot tucked away on a quiet cul-de-sac in The Hamptons. Loaded w/ high-end finishings: Central AC, Hunter Douglas blinds, 2 gas fireplaces, hardwood flooring, coffered ceilings, crown moulding and more. Chefs dream kitchen featuring ceiling height cabinets, stainless steel appliances, walk-in pantry and massive island with bar. 4 bedrooms upstairs including the exceptional primary bedroom which features vaulted ceilings, large walk-in closet & spa like ensuite with lux soaker tub and standup shower. Bonus room offers a perfect space for movie nights by the fireplace. The backyard is absolutely spectacular and offers outdoor living at its very best. Impressive landscaping, deck, gazebo, plating boxes and swim spa. Enjoy the convenience of your double attached garage and ample street parking. Walking distance to walking trails and ponds."
7325 Singer Way,Edmonton,T6R 3R9,South Terwillegar,AB,4,3,3,-1,"$434,800",4251.42,1363,2005,10/8/2021,"Welcome to South Terwillegar with this 1362 sq ft bi level home! Offering 2 + 2 bedrooms, 3 baths, FULLY FINISHED BASEMENT & double attached garage. As you enter you will be impressed with the open concept this home has to offer. The formal living room is open & bright with vaulted ceilings! Leading into the beautiful kitchen featuring plenty of cabinetry, breakfast island and corner pantry. Access the door leading to the deck and landscaped backyard off the dining area. The adjacent family room offers corner tile surround gas fireplace and more vaulted ceilings! To complete the main floor is 1 bedroom & full 4 pce bath. The staircase leads you to the gorgeous master bedroom with full 4 pce ensuite & walk in closet. The FULLY FINISHED basement holds large rec space, 2 bedrooms, 4 pce bath, laundry & TONS of storage! Extras include water softener, water purifier and instant hot water in kitchen & natural gas BBQ hook up! Wonderful location in quiet neighbourhood, yet close to all amenities!"
3312 42A Street,Edmonton,T6L 5W2,Bisset,AB,4,2,2,-1,"$369,000",5397.99,1157,1987,10/8/2021,"Immaculate Home! This beautiful 4 bedrooms 2 full bathroom home offers open concept floor plan with tons of natural light. Features of this home includes granite counters, stainless steel appliances, stylish white kitchen cabinets, tile backsplash, dark hardwood floors, bathroom upgrades, central A/C and a huge private backyard with spacious deck. Located on a quite street, this home is located close to elementary schools, Bisset Park, public transit system and shopping centres. This home is a must see to fully appreciate!"
8945 94 Avenue,Fort Saskatchewan,T8L 1B3,Pineview Fort Sask.,AB,3,2,2,-1,"$319,900",6599.99,960,1971,10/8/2021,"Attention to detail with loads of upgrades that now include a brand new fridge, stove, furnace and hot water tank! If you're looking for move in ready with nothing to do but enjoy the family friendly, mature neighbourhood that's within walking distance to schools and amenities, this is it!"
16711 98 Avenue,Edmonton,T5P 0G9,Glenwood (Edmonton),AB,3,2,2,-1,"$380,000",6362.97,1136,1969,10/8/2021,"Beautiful Bi-level offers great combination of updates, character, & flexibility. Walking distance to schools, this home fronts a quiet street but has unique SIDE lane & REAR lane access. Lower level (via 2 staircases) is ideal for home business or live-in family member because there is a family room, super-large 3rd bedroom (or 2nd living space) + 2nd kitchen space or workshop. Separate back entrance. This home is immaculate, bright & warm, with sunny south backyard & added insulation.  Many improvements make it move-in ready like: XL Primary bedroom created from 2 former bedrooms, updated bathrooms & kitchen. Expanded kitchen now offers open-concept functionality. Outside find several zones/exposures for gardening, patio time, & tinkering in the double heated garage with 220 wiring. RV Parking x2, or total parking for 6 vehicles! Fully fenced & gated yard features landscaping  & underground sprinkler.  BONUS: Windows, mechanical, siding & roof have been replaced over the years! What a well-timed find!"
 Address Withheld,Edmonton,T6J 6S2,Twin Brooks,AB,4,3,3,-1,"$489,900",6584.92,1739,1990,10/8/2021,"Welcome home to this Immaculate Carriage Custom Built Bungalow located on a beautifully treed, quiet street in Twin Brooks. As you enter the front door, you'll be in awe with this impeccably maintained home. There is plenty of room to host family get togethers in the LARGE DINING ROOM and formal front living room. The kitchen features VAULTED CEILINGS, large PANTRY and overlooking the quaint family room with GAS FIREPLACE. Patio doors lead to the extended OUTDOOR LIVING SPACE, which features covered and uncovered patios. The south facing backyard is right out of the  Home and Garden's  Magazine and can be your own private retreat. The basement is fully finished with another family room, games room, wet bar, 3 pc bathroom, Den and Two more HUGE BEDROOMS. All this plus a newer furnace and HWT. Act quickly, as this beautiful bungalow won't last long."
6012 97A Avenue,Edmonton,T6B 1E3,Ottewell,AB,5,3,2,1,"$375,000",6414.64,1227,1961,10/8/2021,"This well maintained property located in the sought after central community of Ottewell offers a fantastic opportunity to buyers of all kinds! If you're looking for a revenue property, a house to renovate and resell, or a chance to build some sweat equity, this house has you covered thanks to its strong bones and location.  Public transportation, reputable schools, shopping, and many parks/playgrounds are a short walk away. You're also within a 5 minute drive from the river valley parks of Gold Bar & Capilano.  The house is a 1232 square foot bungalow with 5 bedrooms.  The main floor is bright and features a dining room, living room, master bedroom with a 2-peice ensuite (a rare feature in this area), 2 additional well sized bedrooms and a full bathroom. The finished basement has a 3 piece bathroom, 2 bedrooms, large rec room, and laundry room. Outside there is a double garage with gas furnace and fenced yard with mature trees. Don't let this opportunity pass you by! Available with immediate possession!"
11606 87 Street,Edmonton,T5B 3M5,Parkdale (Edmonton),AB,2,2,1,1,"$168,250",5371.19,735,1927,10/8/2021,"Lovely character home on a beautiful tree lined street. This charming 2 bedroom home has 2 bedrooms, a full 4 piece bathroom with a claw-foot tub, clean white kitchen, large multi-level deck, and oversized single car garage in the back as well as raised garden beds. The original trim, crown moldings and floors have remained untouched, and some of the windows have been upgraded. The yard has all the bones of exquisite landscaping just waiting for new life to uncover it!"
