address1,city,zip,subDivision,state,beds,baths,full_baths,half_baths,price,lotSizeSqFt,sqft,yearBuilt,dateAdded,description
2064 159 Street,Edmonton,T6W 4K9,Glenridding Ravine,AB,3,3,2,1,"$452,495",-1.0,1518,2021,10/7/2021,"Live in Glenridding Ravines! Nestled in the heart of the SOUTHWEST. CLOSE TO ALL THE AMENITIES. OVER 1500 SF! COMES WITH DOUBLE GARAGE! Open Concept Main floor with 9 FT ceilings! Luxury Vinyl flooring,  Large Kitchen with upgraded cabinets and spacious pantry topped with gourmet level Quartz & stainless steel appliances for all your feasts and creations! Upstairs you'll find a large MASTER, 2 spacious bedrooms and your upstairs laundry. Buy with confidence. Built by Morrison Homes. 2016 & 2017 H.O.M.E Award Winner! Home also comes with front landscaping"
4316 33 Street,Edmonton,T5T 1B5,Larkspur,AB,4,4,3,1,"$474,900",7031.63,1799,1986,10/7/2021,"Welcome to this 1800 sq ft two storey house FULLY RENOVATED 3 years ago. Main floor features high vaulted ceilings, sunken living room and formal dining room. This is followed by kitchen with beautiful granite countertops, dining area and family room with fireplace. Upstairs you will find master bedroom with ensuite and two other spacious bedrooms and another full bathroom. FINISHED BASEMENT includes a large bedroom with walk-in closet, huge living area and another full bathroom. House has central vacuum, heated garage, new hot water tank (replaced 6 months ago) and new humidifier."
17867 8 Avenue,Edmonton,T6W 2S7,Windermere,AB,4,3,2,1,"$649,900",4139.9,2812,2014,10/7/2021,"Better than new! A Stunning 4 bedrooms home located steps from the Ravine & within a walking distance to all amenities. Inside features over 2,800 sqf with more than $100k in upgrades handpicked by an Interior designer.  On the main floor, you will find a grand entrance, den and a specious open layout floor plan that features 10 ft ceilings, prestige hardwood floors, Living room with Fire place, lots of natural light and  a CHEF KITCHEN with granite countertops, pantry,  high-end appliances and a view to the south facing private backyard. Upstairs you will find a massive master bedroom with DREAMS like Ensuite, walk-in closets, built in vanities and double French doors, down the hallway there are 3 more generous size bedrooms, a BONUS ROOM ( that make the perfext flex space), a LUXURIOUS main bath & a large laundry room with built in cabinetry. Outside over $35k were spent on a maintenance free Large deck, landscaping, vegetable garden, privacy fence & oversized finished Double garage.. a Must see home!"
18 53111 Rge Rd 21,Rural Parkland County,T0E 0H0,Crystal Meadows,AB,4,2,1,1,"$399,900",-1.0,1037,1977,10/7/2021,"THE CUTEST & MOST PERFECT ACREAGE IS FINALLY HERE! We mean it! This one has it all! For starters, this home is in a SUPERB location. It is only 15 minutes from Stony Plain in the lovely community of Crystal Meadows and is on mostly paved roads the entire way! The home itself is BRIGHT, AIRY, and PRACTICAL featuring 2 bedrooms on the main floor, with one 4-piece bathroom. The basement features 2 bedrooms and a large 2-piece bathroom with a WALKOUT BASEMENT! It has A/C! There is also a MASSIVE heated & oversized double detached garage on the property. The UPGRADES that have been done to this home NEED to be heard! They include: shingles (Sept 2021), new windows in entire house (spring 2021), both bathrooms reno'ed (2021), basement repainted & brand new carpet (Sept 2021), new HWT (2020). The acreage is 3.44 acres of beauty with a freshly painted red barn, 20'x60' garden, fencing & cross-fencing. Other upgrades: pump & electric on septic (2020), and the well drilled in 2008. DON'T MISS THIS HOME!"
11314 55 Street,Edmonton,T5W 3P5,Highlands,AB,5,2,2,-1,"$452,500",6137.25,1332,1952,10/7/2021,"The Best of Highlands! This large 1332 sq. foot, 3+2 bedroom spacious and bright move-in ready bungalow is located in highly desirable Highlands on a large 50x122 lot. Professionally painted, upgraded electrical and plumbing, home features hardwood floors both upstairs and downstairs, beautiful cove ceilings, rounded corners, glass block accents. The main floor has a bright living room that opens to a spacious dining area, the upgraded kitchen boasts oak cabinetry, ceramic flooring, and stainless-steel appliances. There are 3 large bedrooms and a 4pc bathroom completely redone w/Travertine stone. The fully finished, self-contained open concept basement living area has high ceilings, large windows and extensive lighting.  There is a spacious second living room, full kitchen, bedrooms 4 and 5, 3pc bathroom, and utility/laundry. Wonderful private landscaped yard w/patio, 18x24 Garage w/RV Pad. Minutes from river valley trails, public transportation, Concordia, golf, schools and the trendy Highlands shopping."
4147 Charles Link,Edmonton,T6W 3H1,Chappelle Area,AB,6,4,3,1,"$584,900",4157.56,2160,2016,10/7/2021,"Beautiful 6 bed 4 bath two story in the quiet community of Chappelle, with over 3000 sq ft of living space! This home has all the bells and whistles!! Main floor has large open plan living with gas fireplace and B/I shelving in family room, quartz countertops, SS appliances, large island, gas stove, walk through pantry in kitchen. Large foyer, office, mudroom complete this level. 2nd level has 4 bedrooms! Primary comes with 5 piece ensuite, huge WI closet. 3 more spacious bedrooms, 4 piece bath and laundry complete this level. Fully developed basement offers an in-law suite with separate entrance! complete with full kitchen, family room, 2 bedrooms and 4 piece bathroom. This home has double attached garage, backyard is fully landscaped. Visit REALTOR website for full details."
22 53212 Rge Rd 15,Rural Parkland County,T5Y 0C3,Eden Park Estates,AB,4,2,2,-1,"$534,900",-1.0,969,1984,10/7/2021,"Enjoy the serene private PARK LIKE SETTING in this beautifully maintained completely fenced acreage that comes with an abundance of stunning trees. LESS than 20 minutes west of Edmonton and only MINUTES away from Stony Plain & Spruce Grove.  This NICELY UPDATED warm and inviting fully finished 2+2 bedroom 2 bathroom bilevel with a separate entrance to the basement features over 1820 sqft of developed living space. There have been many upgrades throughout the years which include newer windows, shingles, front & back decks, paint, flooring, kitchen & bathrooms. This well laid out home comes with a large living room area and lots of storage. The gorgeous maple kitchen comes with an abundance of cabinets & QUARTZ countertops. There is a 2005 24 by 26 double garage w/ 10 foot ceilings and large concrete apron. There is Drilled well and Septic Tank & Field (2004) . Also there is a huge fully fenced area for animals & several out buildings. Just move in and enjoy acreage living!"
758 Whiston Court,Edmonton,T6M 2H6,Oleskiw,AB,4,3,2,1,"$489,900",5000.37,1847,1996,10/7/2021,"Gorgeous 2 Storey Home in the Country Club. When you walk in you will love the Grand entry with spiral staircase. There is a formal living and dining area off the entrance. The Kitchen is open concept to the family room and has a dining nook in between. Upstairs you will find a Primary bedroom with a 4 pc Ensuite and walk in closet. There are 2 more bedrooms up here with access to a 4 pc bathroom. The Fully Finished basement offers a 4th bedroom, recreation room, den and a storage room. The home has a beautiful yard and double attached garage."
301 Fairway Drive,Stony Plain,T7Z 2M8,The Fairways_Stpl,AB,4,4,3,1,"$425,000",6910.96,1796,2000,10/7/2021,"Fantastic location in the highly desired neighborhood of The Fairways in Stony Plain! Located just down the road from the golf course, playground, walking trails and greenspaces is this 1750+ sq ft fully finished two-storey with a gorgeous south facing huge backyard that has tons of room for the family! Updates include newer shingles, furnace, hot water tank, kitchen appliances, and more! The main floor you'll absolutely love with a convenient boot room with laundry/storage, foyer with soaring ceilings, and a spacious kitchen to open concept living room where you'll enjoy the view of your backyard. Upstairs has three bedrooms plus a perfect reading or homework spot! The primary retreat features tons of natural light and an en-suite with a corner tub! The basement is finished with a wide-open recreation room, 4th bedroom and a 3 piece bathroom! Loaded with value this property is ready for you and your family to call it home!"
 Address Withheld,Edmonton,T5L 3Y3,Wellington,AB,3,2,2,-1,"$374,900",-1.0,1039,1958,10/7/2021,"LOOKING FOR MOVE IN READY??? This 1000+sq.ft Home has been almost FULLY RENOVATED and the location is Convenient and Quiet. You are nestled between 2 SCHOOLS (less than 1 block away), great neighbors, a short drive to all the SHOPPING AND RESTAURANTS you could ever want, and a quick walk to public transit. The Main Floor has a Living Room and Dining Area with Tons of NATURAL LIGHT, and Fully Updated Kitchen. You will also find the Master Bedroom with HIS AND HERS CLOSETS, another Full Size Bedroom and a Den/Office that could easily be converted to a young childs Bedroom. The Main Floor Bathroom is ABSOLUTELY STUNNING, featuring Jetted Tub, Rain/Massage Shower, Skylight and HEATED FLOORS! The Basement has a SEPARATE ENTRANCE and could be transformed to a rental suite with a few changes. Basement is fully finished with a Bedroom, Full Bathroom, 2 Separate Living Spaces and Laundry Room/Storage. Outside you will find a HUGE OVERSIZED DOUBLE GARAGE for all your toys! ...Just move in and ENJOY!"
3916 Claxton Loop,Edmonton,T6W 1Y6,Chappelle Area,AB,4,3,2,1,"$569,900",4161.86,2567,2014,10/7/2021,"This beautiful home is located in Chappelle, offering 2,567 SqFt, 4 bedrooms+den and 2.5 bathrooms. The main floor features a mudroom/laundry walk thru pantry to the LARGE maple kitchen with granite counters, countertop gas stove, wall oven and stainless steel fridge.  The dining room overlooks the backyard & large deck. Completing the main floor is a den/office/bedroom, living room with gas fireplace and a 2 piece bath. Upstairs there are 3 good sized bedrooms & a 4 piece bathroom.  They primary bedroom offers a lovely large 5 piece ensuite bathroom & walk in closet. Full completed landscaping and fencing. The basement offers a separate entrance and is available for a potential legal suite and your customizing! ALL this home NEEDS is YOU!!"
4710 49 Street,Cold Lake,T9M 1Y4,Cold Lake South,AB,3,2,2,-1,"$179,900",-1.0,1027,1971,10/7/2021,"PERFECT OPPORTUNITY FOR INVESTORS OR FIRST TIME BUYERS!! This home offers 2 + 1 bedrooms and 2 baths. A side entrance leading to a fully FINISHED basement with 3rd bedroom, second possible kitchen area, living room, 3 piece bathroom and laundry room. Great In-Law suite potential. Located on a large mature lot with back alley access. Tons of space to add a detached garage. Several updates including - shingles/eavestroughs (2014) HWT (2018) high efficient furnace. Newer flooring throughout and kitchen countertops . This home is located near all the amenities, schools, shopping and transit! Solid build with so many possibilities.. just waiting for you to move in!"
1115 75 Street,Edmonton,T6K 2S4,Menisa,AB,5,4,3,1,"$429,900",-1.0,1862,1977,10/7/2021,"QUALITY UPGRADES, BEAUTIFUL YARD, STEPS TO PARK AND SCHOOL!  Pride of ownership throughout in this immaculate home.  5 bedrooms, 4 baths (3 full).  Spacious main floor family room.  Many quality upgrades including: luxury stainless steel appliances, newer windows, all newer paint (trendy colors), newer hardwood flooring, major bathroom upgrades, newer custom window coverings, some kitchen upgrades, newer fence, newer shingles, brand new furnace/HWT/AC, new fencing, etc.  Private, secluded rear yard - unusually large (7,033 square foot lot).  Generous sized deck (treated wood) with railings.  Outdoor firepit area - great for weekend family gatherings.  Workshop and large cold pantry in basement.  Programmable exterior lights.  Excellent location: quiet, peaceful street, just steps (6 homes) from Menisa School/Menisa Park."
10547 76 Avenue,Edmonton,T6E 1L4,Queen Alexandra,AB,3,2,2,-1,"$325,000",-1.0,843,1946,10/7/2021,"WALKABLE, SPACIOUS, 2+1 bedroom bungalow in one of Edmonton's central family neighborhoods - Queen Alexandra. Quick access to public transport & bike lanes, & only minutes to Downtown, U of A & our gorgeous River Valley trails & parks. Walk to Whyte Avenue & Old Strathcona. Enter to a bright, spacious living room w/ tons of natural light & newer laminate flooring. The kitchen is open & bright w/ plenty of storage in the classic, new, IKEA white cabinets w/ matching appliances (brand new electric stove!) & breakfast bar. Relax in either of the two large, main floor bedrooms (one with a walk-in closet) plus the brightly tiled 4pc bathroom. The fully finished basement has a second large kitchen, a spacious living room, 3pc bath w/ shower, & one more bedroom, plus laundry room & storage area. The large, private backyard is fenced & landscaped w/ deck, pergola, & planter & provides access to the detached double garage & parking pad. Entire home has been generating up to $2100/month in rent! Welcome Home!"
37 Blueberry Crescent,Sherwood Park,T8H 1P6,Clarkdale Meadows,AB,5,4,3,1,"$509,900",-1.0,1935,1991,10/7/2021,"Welcome to this FULLY RENOVATED family home in the heart of beautiful Clarkdale Meadows. This immaculate 5 bed + 3.5 bath home has so much to offer!! Some of the features include a nice size den for that needed home office, two family rooms including a wood burning f/p, beautifully upgraded kitchen with BRAND new never used stainless steel appliances, patio doors off of the dining room to the deck overlooking the private treed back yard. Main floor laundry + 2 pce bath completes this floor. Going upstairs you will enjoy the huge primary bedroom including a spa ensuite with a soaker tub. Next you have three bright, nice size bdrms + a 4pce bath with a skylight. Downstairs you are greeted with a huge fully finished basement with another 4pce bath and a fifth bedroom. Completed with a oversized double attached garage with shelving & lets not forget the front veranda & flower boxes included waiting for your green thumb. Parks, playgrounds and schools are a short walk or bike ride away. Welcome Home!"
5509 46 Street,Stony Plain,T7Z 1E1,Woodlands_Stpl,AB,3,4,3,1,"$382,500",5532.97,1431,1987,10/7/2021,"Immaculately maintained, extensively upgraded & backing onto whispering waters creek, a peaceful walking trail made complete with natural scenery & bridge. Home has a spacious floor plan with plenty of window space that invites natural sunlight. Main level has living & dining area, powder room, eat-in kitchen & access to a gorgeous backyard. Upper level has 3 bedrooms (primary bedroom has 3-piece ensuite) & family bathroom. Basement has den, bathroom, recreation room & plenty of storage space. Garage is oversized & there's room for an RV on your pad. Numerous upgrades include new shingles & upgraded venting (2021), new eavestroughs (2020), new furnace (2020),  H2O tank (2019), windows & coverings in living & dining rooms (2020), new paint & trim on main plus upper levels (2020). Easy walkability to schools, playgrounds, outdoor pool & rink, splash park, baseball diamonds, downtown shopping, library, multi-cultural centre & more. Home also offers easy access to Highway access to Highways 16, 16A & 779."
36 Greenwood Close,Spruce Grove,T7X 1Y1,Grove Meadows,AB,3,3,2,1,"$342,000",5457.3,1073,1980,10/7/2021,"How refreshing!! I think that's how you'll feel when you step into this charming three level split in Grove Meadows.  Brand new flooring throughout the entire house, new baseboards and modern trim, entire house has been painted including ceiling, new doors and hardware, counter tops, sink and tap and bathroom upgrades! The shingles were done in 2016 and exterior of home was painted in the recent weeks.  Features three bedrooms, two piece ensuite, amazing fully finished lower level with a washroom and Jacuzzi tub, huge open concept main floor, this home is turn key.   Large storage shed in the back as well as extra parking or RV parking. Six minute walk to Greystone Centennial Middle School, four minute drive to Jubilee Park and a great neighbourhood with amazing neighbours!"
3103 61 Avenue,Rural Leduc County,T4X 0X4,Royal Oaks_Ledu,AB,3,4,2,2,"$1,198,800",-1.0,2381,2013,10/7/2021,"EXQUISITE DETAIL! This luxurious 1+2 bdrm, 4 bath home with a WALKOUT bsmnt in the Royal Oaks development has 2381 + 2243 sq ft of gorgeous living space. You are greeted with high ceilings in the spacious entryway. Beautiful hardwood floors take you through to the open concept kitchen and living room. The gourmet kitchen features tons of cabinetry, exquisite fixtures, granite countertops, large island & built in ss appliances. The stunning brick feature wall holds the gas fireplace and highlights the living room features beautifully. Access the back deck with POND VIEWS through the dining area. The spacious master bdrm features a luxury 5 pce spa ensuite, separate balcony & walk through closet leading into the laundry area! Glassed in den & custom mud room complete this level. The fully finished WALKOUT bsmnt feats rec room, bar, theatre, 2 bdrms, 3 pce j&j bath, add 2 pce bath & tons of storage! So many details that must be seen to be appreciated!"
 Address Withheld,Rural Barrhead County,T7N 1N2,None,AB,4,4,3,1,"$735,000",-1.0,1582,1997,10/7/2021,"Look no further!! The dream home you have been looking for on 10 acres of gorgeous treed landscaped and manicured yard with a 4 bedroom 4 bathroom home that is a delight to see with high ceilings,light and flowing kitchen and dining area along with sitting areas and liesure sitting rooms. 3 bedrooms up with large 16 by 13.5 master and 4 piece ensuite along with jetted tub,other bedrooms large and roomy, 2 huge rec rooms downstairs with bar, spacious 14 by 22 bedroom,and large utility room with great workshop area. Outside there is so much, 18 ft round concrete fireplace sitting area, gardens, walkways, a large almost 500 sq ft deck, and a great 40 by 60 heated shop with 3 overhead doors and 16 ft ceiling. No expense spared!! A must see and only 2.5 miles south of town"
9823 222 Street,Edmonton,T5T 7B9,Secord,AB,3,3,2,1,"$493,000",4208.68,2034,2016,10/7/2021,"The search is over! Welcome to this beautiful 2 storey, 2,029 sq.ft., 3 bedroom, 2.5 bath, home in the family oriented neighbourhood of Secord. The open concept main floor features hardwood thru-out, an inviting living room w/a coffered ceiling, large windows, gas fireplace, large kitchen w/an impressive island, granite countertops, S/S appliances, walk-thru pantry, an eating area that could easily sit a large family, 1/2 bath & a grand 2 storey entrance. Upstairs you will find a large bonus room which is perfectly developed for entertainment, primary bedroom w/a 4 piece ensuite & walk in-closet, 2 additional bedrooms, a 4 piece bath & a spacious laundry room. The lower area is unfinished & is ready for your personal touches. The backyard is fully fenced with a large 2-tiered deck, great for BBQ's & family gatherings.  Located close to parks, schools, shopping, public transit & easy access to the Anthony Henday."
62207 Highway 63,Rural Thorhild County,T0A 2P0,None,AB,3,1,1,-1,"$340,000",-1.0,1664,2008,10/7/2021,"HERE IS A PROPERTY WITH LOADS OF POTENTIAL - 10 acres right on Hwy 63. Home has 1,664 sq. ft. with 3 bedrooms & 1-3PC bath. A few features of the home include; in-floor heat, siding is made of half log & chinking, & a metal roof. Set to the back of the property, giving this home privacy & a nice long drive way. Open concept, vaulted ceiling in the - large country style kitchen & the oversized living room has French doors leading out to the COVERED DECK. The WOOD COOK STOVE, centered between the living room & kitchen, great for a quick warm up or cooking. MANY UPDATES INCLUDE: Boiler, Paint & Flooring, Bathroom, Windows & Doors. The boiler system installed in 2020 - heats the house, pump house & workshop. The porch has ample space for everyone to get into the house, hang up their coats & getting their shoes off. The laundry has additional storage & roughed in plumbing for a 4-pc. The Workshop - it is heated, one bedroom, 4 pc bathroom and laundry.  20 mins.- Boyle, 40 mins.- Athabasca & 3 hrs-Ft. McMurray"
13 Swallow Crescent,St. Albert,T8N 0K6,Sturgeon Heights,AB,4,2,2,-1,"$374,900",6587.51,1064,1962,10/7/2021,"Welcome home to 13 Swallow Crescent. This beautiful bungalow is located in a quiet & mature neighbourhood boasting 4 bedrooms, numerous renovations w/ newer flooring throughout, large spacious yard & oversized heated garage. As you enter the house, the gorgeous hardwood floors lead you to the spacious living room w/ large windows offer plenty of natural light. The bright renovated kitchen comes complete w/SS appliances, plenty of counter space + large dining room. The main level also include 3 bedrooms, updated 4 pc bath and front foyer area. The fully finished lower level includes massive family/rec space w/ gas fireplace, 4th bedroom, storage area, 4pc bath + laundry room. The beautiful backyard comes completely fenced & landscaped w/ plenty of greenspace to enjoy. This home is ideally located with its central located in St. Albert steps from schools, parks, amenities and transportation."
48 Newbury Court,St. Albert,T8N 0P8,North Ridge,AB,5,4,3,1,"$739,900",-1.0,2290,2007,10/7/2021,"This Stunning 5 Bedroom 2-Storey Walkout backs onto Beautiful Dixon Pond! An absolute dream location situated in a quiet cul-de-sac with views that are breath taking! Main Floor Great Room boasts a two-sided fire place that is shared by a large office area. Soaring windows with breath taking views of the lake.  Large Dining area with adjacent deck for your BBQ to relax and enjoy watching the sunrise over the pond.  Chef's Kitchen boasts stainless steel appliances, granite counter tops, huge island, corner pantry and hardwood floors. The Upper level has a large Master Bedroom with Lake Views, 5 piece Ensuite with Double Sink/Soaker Tub, Shower and Walk-In closet. 2/3 bedrooms are huge with walk in closets. Fully Finished Walkout basement lends a total of 3379 sq ft of living space with 2 large bedrooms, Family Room with Gas Fireplace and Gym area.  Covered paved deck and large back yard facing the pond with lots of areas to sit and enjoy! Lots of Upgrades and Zen feel of this home make it a must see!!!"
23 Springwood Way,Spruce Grove,T7X 0L4,Spruce Ridge,AB,3,3,2,1,"$315,000",3024.66,1328,2013,10/7/2021,"Absolutely STELLAR and CLEAN AS A WHISTLE 2013 built Duplex with IMMEDIATE POSSESSION! Ohhh this unit is gonna look better than the other 5 you see guaranteed! Completely move-in-Ready, this 3 Bed, 2.5 bath unit has a A few extra goodies; Modern white Fireplace with mantle, beautiful upgraded hardwood floors, black ceramic tile, Large Backyard as well a a BIG deck! Main floor has a half bath, single attached garage, bold white trim and modern pinterest white colors (all set for your 10,000 succulents). Beautiful Kitchen with a corner pantry, upgraded sexy SS hoodfan, Dark Cabinets SS appliances. Large Living room, quite a spacious layout given it's a bit larger than most single garage duplexes. Upstairs, 3 Excellent sized rooms, storage, 4pc main bathroom and primary bedroom with a 4 pc squeeky clean ENSUITE! Close to walking trails, Walk to the Tri Leisure Centre, Superstore, restaurants, and quick access to the Yellowhead! This is THE Duplex to buy right now!! Let's GOOOOOO!"
10802 64 Avenue,Edmonton,T6H 1T2,Allendale,AB,5,3,2,1,"$419,900",5726.5,1328,1950,10/7/2021,"Attention Investors!!! This 44'x130' CORNER lot is zoned RF3 and prime for future redevelopment. Build a duplex or garden suite or whatever combination you can dream up. Currently this cute one and a half storey home is solid and a great investment itself with a separate two bedroom unit in the basement. Main floor features a dining room, and large living room with hardwood floors and fireplace. Renovated kitchen with stainless steel appliances and a breakfast nook. Main floor bedroom could be used as a great home office. 4pc bath on main. Upstairs has a large master bedroom with a rare 2pc ensuite. 2nd upstairs bedroom is great for kids or guests. Basement features SECOND KITCHEN, 3pc newly renovated bathroom, living room & 2 more bedrooms. Shared laundry. Beautiful fenced lot with mature trees, a deck and single garage off back alley. Close to University & Southgate Mall."
8507 139 Street,Edmonton,T5R 0G6,Laurier Heights,AB,3,4,3,1,"$789,000",7996.82,1452,1962,10/7/2021,"Pretty property located in East Laurier. Quiet + serene micro-location, this home is walking distance to schools, parks, restaurants, grocery, Zoo, Sir Wilfrid Laurier, off-leash dog park + the beautiful trails of our river valley <3. This big & beautiful split level home features approx. 2675 total  sq.ft. & is equipped with 2 kitchens & 2 laundry rms. Beautiful bright main floor features welcoming foyer, U-shaped kitchen + laundry, dining & living complete with period piece wood burning fireplace. Up has a total of 3 bdrms, updated 5piece family bath & 3piece ensuite. Down the curved staircase leads to the 2nd living area featuring a ground level walkout garden doors to the huge east facing backyard. Newer kitchen with lots of cabinets, + granite tops. Large living room, half bath + 4peice washroom featuring a walk-in bathtub, 2 vanities, shower & laundry. The lowest level includes a large rec room, den, lots of storage & utility/workspace. Lifestyle location in ever desirable Laurier Heights."
