address1,city,zip,subDivision,state,beds,baths,full_baths,half_baths,price,lotSizeSqFt,sqft,yearBuilt,dateAdded,description
11804 174 Avenue,Edmonton,T5X 0A3,Canossa,AB,3,3,2,1,"$409,900",4155.4,1907,2006,10/6/2021,"Gorgeous 3-bath, 2.5-bath home in the amazing Canossa community! This 2-storey features a beautiful vinyl exterior with brick accents, an oversized double attached garage, huge 19ft x 14ft deck, and fully fenced backyard (with no rear neighbours). The main floor has a mix of ceramic tile and hardwood throughout, with column accents at the entrance and living room. Kitchen is connected to the mudroom/laundry room through a large walkthrough pantry. The spacious open to below living room has plenty of windows allowing tons of natural light into the space, and features a beautiful fireplace. Upstairs you'll find beautiful crown moulding and 3 generous bedrooms (2 with walk-in closets). The primary has a vaulted ceiling, separate his & hers closets, and ensuite with both a jet tub and stand up shower. Conveniently located just south of the Henday, near 127 St & Newcastle Shopping Centre. Recent upgrades: carpet upstairs (2021), SS appliances (2020), fence (2011)."
4422 45 Avenue,Bonnyville Town,T9N 1X4,Bonnyville,AB,3,3,2,1,"$199,500",-1.0,1102,1977,10/6/2021,"Affordable 1100 sq. ft. bungalow features 3 bedrooms, 3 bathrooms with a 2 pc bath off the master. The basement is partially finished with 3 pc. bath and cold room. The mature yard is fully fenced and conveniently located close to schools and park."
5010 47 Street,Myrnam,T0B 3K0,Myrnam,AB,3,1,1,-1,"$109,000",-1.0,959,1928,10/6/2021,"DOUBLE THE POSSIBILITIES- Sitting in Myrnam on 2 lots is this 3 bedroom,  960 sq ft bungalow loaded with potential. I'm pretty sure you'll love the convivence of main floor laundry and being able to gather the family in the dining room for  special occasions.  Step out to the back yard and find a vegetable garden to satisfy your green thumb a fire pit to sit around on those lazy summer nights, and to top it off a heated double detached garage that would make the perfect man cave or workshop. This home is great for the first time buyer or a handyman project. Don't wait to see this one!"
125 Mclaughlin Drive,Spruce Grove,T7X 0K3,Mclaughlin_Spgr,AB,3,3,2,1,"$321,000",2906.25,1266,2010,10/6/2021,"Welcome to your new home in this lovely McLaughlin duplex. Walking into the home you are greeted by the open living room/kitchen/dining area with windows letting in a lot of natural light. Cherry cabinets and stainless steel appliances in the kitchen. Beautiful fireplace in the living room to cozy up to in cold Alberta winters and an open area for your dining table. You will also find a 2 piece bathroom on the main floor. Upstairs boasts 3 bedrooms, 1 full bath and the master with an ensuite full bath. Downstairs you will find the main living area is partially done and just waiting for your finishing touches. There is also the laundry and storage room. Outside you have a wooden deck and fully landscaped yard with a shared back fence. Upgrades include new Shingles, Air Conditioner, Washer / Dryer, Fridge, Shed & Gazebo. You are minutes away from restaurants, groceries and the tri-leiusre centre."
 Address Withheld,Leduc,T9E 1B6,West Haven,AB,3,3,2,1,"$589,900",4786.92,2421,2021,10/6/2021,"IDEALLY LOCATED ACROSS FROM SCHOOL! TRIPLE CAR GARAGE! Nestled in the young vibrant Community of West Haven this functional open concept design is perfect for living & entertaining! Contemporary kitchen offers timeless white cabinetry, quartz counters, stainless appliances, large island with seating, walk-thru pantry & generous size eating area. Living room has spacious open to above floor plan with stylish & convenient gas fireplace. Upstairs houses 3 bedrooms including a spacious master suite has walk-in closet & 5pce bath with double sinks, luxurious soaker tub & glass shower. The basement awaits your personal touches with SEPARATE ENTRANCE, 3 windows & roughed in bathroom plumbing. Enjoy spending time outside year round on the covered deck with gas barbecue hook up. Additional features include main floor laundry room with sink, den, bonus room, tempered glass railings, wide hallways, bonus room & luxury vinyl plank. THIS IS A PLACE YOU WILL BE PROUD TO CALL HOME!"
17807 6 Avenue,Edmonton,T6W 2G6,Windermere,AB,3,3,2,1,"$399,800",3369.32,1461,2013,10/6/2021,"Welcome to Windermere! This 2 storey home is located in a quiet neighbourhood close to all amenities! Featuring 1461 sq ft, 3 bedrooms, 2.5 baths and double detached garage! Enjoy the open concept floor plan upon immediate entry. The hardwood floors take you through the bright living room to the the gourmet kitchen offering breakfast island, black & stainless steel appliances & ample cabinetry. Access the landscaped back yard and double detached garage off the formal dining area! To complete this level is the 2 pce bath and main floor laundry. The upper level holds the master suite with walk in closet and 4 pce ensuite. 2 additional bedrooms, full 4pce bath complete the upper level! The unfinished basement awaits your personal touch. Welcome Home!"
138 West Liberty Crescent,Millet,T0C 1Z0,Millet,AB,4,3,2,1,"$285,000",-1.0,1213,1985,10/6/2021,"NICELY UPDATED! HUGE YARD! SUNROOM! SECOND KITCHEN! This 1212 sq ft (2271 TOTAL) 4 bedroom + HOME OFFICE / DEN family home on desirable West Liberty Crescent has been refreshed! New carpets, paint, bathroom tub & tile, ensuite flooring, along with a newer roof, some windows, hardwood, and a gorgeous sunroom! The main floor brings a spacious living area w/ large bay window, dining area, L-shaped kitchen w/ newer fridge and dishwasher, renovated 4 pce bath, & 3 beds including the primary w/ 2 pce ensuite. SIDE ENTRY doorway leads t your basement, w/ sprawling rec room, second kitchen, 3 pce bath, 4th bedroom, den / office, and ample storage! The backyard is home to numerous trees, with apples for days! Plenty of room for the kids to play, summer BBQs, bonfires, and spending time relaxing. Single detached garage for parking or tinkering on projects. Located close to playgrounds, greenspace, and walking distance to the Agriplex; great location! Don't miss it!"
9625 76 Avenue,Edmonton,T6C 0K4,Ritchie,AB,3,2,2,-1,"$394,900",5064.41,727,1948,10/6/2021,"LOCATION! LOCATION! RITCHIE! The location alone makes this home #1 on your list. This bungalow is a perfect starter home; two bedrooms up, newer paint throughout, hardwood in the living room and both bedrooms, tile in the bathroom and slate flooring in the kitchen. The basement features a professionally developed and self contained second  kitchen, 1 bedroom, 3pc bath and lots of closet/cabinet space. Separate entrance, and laundry area downstairs. Back yard boasts a soothing water pond and large deck, perfect for entertaining. Over-sized newer single car garage (18.5x28) to keep your car warm on those cold winter nights. Within walking distance  to ALL amenities, schools, public transportation and just minutes to downtown. One block from the Millcreek ravine."
908A 9 Street,Cold Lake,T9M 1H8,Cold Lake North,AB,3,2,1,1,"$152,500",-1.0,1135,1977,10/6/2021,"Just 2 minute walk to the marina, to drug store and restaurants. This wonderful half duplex starts by welcoming you into the living room, open concept kitchen and dining area and a 2 pc washroom on the main floor.  Upstairs with 3 great size bedrooms and full bath. Majority of the renovations were completed in 2016, new kitchen, flooring, new door, majority of the windows, new furnace, hot water heater, trim, paint and recently built new deck. Great value in a great location!"
58 Mcnabb Crescent,Stony Plain,T7Z 1G9,Forest Green_Stpl,AB,3,2,2,-1,"$310,000",-1.0,905,1981,10/6/2021,Located in a peaceful neighbourhood with beautiful walking trails. Stunning 3 bedrooms. Gorgeous kitchen with spacious living.
4 Henderson Court,Spruce Grove,T7X 0C6,Harvest Ridge,AB,3,3,2,1,"$414,900",4822.23,1850,2007,10/6/2021,"Every inch of this GORGEOUS 1851 sq ft 2-Storey has been IMMACULATELY MAINTAINED. The spacious entryway leads to a BRIGHT, open concept main floor featuring beautiful ceramic & HARDWOOD floors, great lighting fixtures plus a COZY gas fireplace. Kitchen features maple cabinets, STAINLESS STEEL appliances, a corner pantry & island with breakfast bar. Waiting for you upstairs is a FABULOUS master bedroom with a huge walk in closet & relaxing 4 pc ensuite w/soaker tub. A fantastic bonus room highlighted by vaulted ceilings, 2 additional large bedrooms & a 4pc main bath complete this level. The fully fenced & landscaped yard backs onto a walking trail & comes with a large 2 tiered deck with built in privacy complete with a HOT TUB & gorgeous PERGOLA. The basement has been framed & there is central A/C.  This AMAZING family home is Move in Ready!"
2548 Lockhart Way,Cold Lake,T9M 0B2,Cold Lake North,AB,4,3,3,-1,"$424,900",-1.0,1653,1996,10/6/2021,"Great location within walking distance to MD Park, beach and playground.  This fully developed family sized home has 4 bedrooms and 3 baths.  Main floor has vaulted ceilings with plenty of pot lights, large windows and 3 skylights.  The kitchen has loads of cabinetry, beautiful back splash and a sun filled dining nook.  A garden door that leads to a covered patio with glass railings for a clear view of the fully fenced backyard.  Main floor laundry for your convenience.   Stay cool in doors with the multi-functional air conditioning system with options for heat and a humidifier. The carpet in this home is all new and high end. The basement has an ICF foundation and in-floor heat, a games room, family room, large bedroom, 3 piece bath and a huge storage room. The attached heated garage also has an additional  storage room and a man door that leads to the side yard.  20 years warranty remaining for the boiler system. Shingles with 30 year warranty recently installed."
 209 59412 RR 95,Rural St. Paul County,T0A 3B0,None,AB,4,3,3,-1,"$349,500",-1.0,1667,1988,10/6/2021,"WHO WOULDN'T WANT TO WAKE UP TO THIS VIEW! Located at beautiful Vincent Lake, this family home is welcoming & has everything you need.  The main floor boasts a convenient kitchen and large dining area big enough to host any gathering. Loaded with character, the living room is the place to cozy up in with large bright windows & a wood burning fireplace. The master bedroom is truly your own getaway as it's the main feature of the upstairs with its own private balcony over looking the lake. With both a soaker tub and separate shower, the ensuite is just for you. Downstairs provides endless options for games, movies, hobbies or whatever you can think of. Summers will definitely be spent outside on the huge tiered deck and patio.  With a bit of your own touch, this can be the home you've always dreamed of!"
11439 66 Street,Edmonton,T5B 1H7,Highlands,AB,3,2,2,-1,"$329,900",4059.07,816,1942,10/6/2021,"Lovely little home in the community of Highlands! This home sits on a large lot with a double detached garage that has a loft area upstairs perfect for a home office or studio. The yard is fully fenced and landscaped with a hot tub and powered cover (Covana).  The main floor offers 2 bedrooms, 4 piece bathroom and an open concept kitchen, dining room and living room with an electric fireplace. The updated bathroom has a large corner soaker tub and has a small fire table. Sub flooring was replaced on the main floor as well as an updated kitchen. The kitchen has ample cabinet and countertop space with a raised eating bar and small island. Downstairs you will find a bedroom with 3 piece ensuite, family room and a kitchenette. This home has a great location close to all amenities, close to Northlands Expo Center and has quick access to the Yellowhead.  A must see property!"
1771 Westerra Loop,Stony Plain,T7Z 0K9,Westerra,AB,3,3,2,1,"$475,000",4370.04,1929,2017,10/6/2021,"This gorgeous 3 bedroom home is located backing green space and a pond in the great neighbourhood of Westerra! The open floor plan features a large eat in kitchen boasting quartz counter tops, a living room complete with fireplace, a walk through pantry and a large foyer located off of the garage entrance. Upstairs you will find 3 bedrooms and a spacious bonus room. The primary bedroom features a walk in closet, as well as a 5 piece ensuite complete with a large tub, a separate shower and private water closet. Upstairs their is another full bathroom and laundry room which offers a ton of extra storage and hanging space. No details have been missed in this home, from the decorative wall papers, board and batten, tons of windows, central air, an extra long driveway and an oversized 22x23 attached garage! This home is located close to scenic walking trails, the outdoor rink, a playground and basketball court!"
653 Village Drive,Sherwood Park,T8A 4K7,Village On The Lake,AB,4,4,3,1,"$544,900",5500.35,1862,1980,10/6/2021,"CHARMING 2-storey in Village On The Lake awaits!  Featuring 3+1 Bdrms & 3.5 Baths - this spacious, EXTENSIVELY RENOVATED home is simply perfect!  Large, bright eat-in Kitchen w/ new SS appliances, gas stove, upgraded cabinetry, granite countertops and tons of storage.  Formal Dining & Living room blend nicely together w/ new hardwood flooring throughout the entire house   no carpet!  Enjoy the private & separate Family Room w/ cozy wood-burning fireplace and gorgeous mantle.  Upstairs, you'll unwind in your generous Master Bdrm feat a 4-pc Ensuite, double walk-in shower & large walk-in closet.  Two more good size Bdrms and 4-pc Bath, up.  Your Basement is fully-developed w/ lg room for theater area/home office/exercise area/4th Bdrm.  Outside, you'll love to entertain or watch the kids play in your private, treed backyard.  SO MANY UPGRADES throughout! Inc NEW: Shingles/Gutters, Triple-Pane Windows, HWT, Kitchen Appliances, Garage Door/Motor.  2 Lennox furnaces.  Terrific location!  A TRUE MUST SEE!"
10217 139 Street,Edmonton,T5N 3R2,Glenora,AB,4,4,3,1,"$835,168",3506.23,1911,2019,10/6/2021,"WOW factor throughout this stunning home with over 2800 sq.fr of developed living space! This exclusive two storey is filled with Upgrades:  Boasts 10' CEILINGS on main, 9' ON SECOND, large TRIPLE PANE windows throughout, exterior ACRYLIC STUCCO, BRICK AND METAL, 8' INTERIOR DOORS and massive PATIO DOORS, CHEFS KITCHEN w/ ample countertop space, GAS RANGE. Can't forget to mention the built in CUSTOM CABINETRY, SOFT-CLOSE BARN DOORS, CEILING SPEAKERS, UPGRADED LIGHT FIXTURES, LED CRYSTAL LIGHT FIXTURE, BRICK WALL, ENGINEERED HARDWOOD, QUARTZ COUNTERTOPS, LARGE TILED SHOWER IN ENSUITE, CUSTOM CLOSETS, HUNTER DOUGLAS BLINDS W/6 ELECTRIC, WATER SOFTNER SYSTEM, A/C, INSULATED & DRYWALLED GARAGE.  No details overlooked in this gem. Main floor bar area with beverage fridge and a large dining room is perfect for entertaining. There is no lack of space with OVER 2800 SQ FT OF DEVELOPED LIVING SPACE.   Prime location close to Downtown, West Block, and the ravine!"
23032A Old Fort Trail,Rural Sturgeon County,T8L 5E1,None,AB,1,1,1,-1,"$175,000",-1.0,1163,1969,10/6/2021,"Lot value with all services, Power, Natural Gas, City Water. The lot is .87 Acres with a 1088 sq ft bungalow on it. The home is a tear down and this property is sold \u0022AS IS WHERE IS\u0022. Build your own dream home close to the city and Fort Saskatchewan."
4 53522 Rge Rd 274,Rural Parkland County,T7X 3T1,Muir Lake Ridge,AB,4,4,3,1,"$730,000",-1.0,2046,2003,10/6/2021,"Welcome to Muir Lake Ridge! Live your dream only 7 mins (on paved roads) from Spruce Grove! This custom built home has some of the most incredible features like detail accented hardwood floors, a river rock gas fireplace, a generous sized kitchen and a front veranda to enjoy the morning sunrise. The property is meticulously maintained and is fully fenced.. This acreage boasts a triple garage and manicured landscaping from the front of the acreage to the back fence AND backs onto a municipal reserve. There is a fire-pit with a seating area that is built into the rolling hills of your backyard and the views of the Glory Hills are simply stunning! This acreage was built around living a life you love, living YOUR DREAM! All of the bedrooms are oversized and the primary suite takes up the entire west side of the upper floor, with a huge walk-in closet and large ensuite. There is also a den/5th bedroom on the main floor. There is so much more to this property you will have to see for yourself!"
580069A Rr200,Rural Lamont County,T0B 2R0,None,AB,4,3,2,1,"$969,500",-1.0,1710,2018,10/6/2021,"Say goodbye to the city hustle and bustle. Here you'll find peace and quiet on 134.92 acres of privacy. A Custom-built, fully developed 1710 sq. ft. bungalow by Gentry Homes is a must-be seen to appreciate. Gorgeous country-style kitchen with an abundance of soft-close cupboards & counter space, apron sink. Top-of-the-line appliances, a chef's dream spacious island overlooking the dining room living room with cedar beams & posts plus wood burning fireplace. A hallway with loads of windows leads you to the primary bedroom. 5-star hotel style with a 5PC ensuite, copper sinks, marble steam shower, claw tub & heated floors. Custom-built barn door and bathroom cabinets will make your friends envious. Laundry is off the bedroom, plus access to the deck & hot tub from the patio door. A 2PC bath & roomy back entry lead to the garage (28'x30') access. Downstairs you have a family-sized rec. room, 2 bedrooms, 3 piece bathroom, a cold room & utility room. Wildlife, trails, and so much more. Your new home awaits"
6 Sedona Place,Fort Saskatchewan,T8L 0N7,South Fort,AB,3,4,3,1,"$515,000",4402.97,1945,2013,10/6/2021,"Exceptional home with over 2600sqft of finished living space that is move-in ready. The entrance greets you with a den/flex room and then into an open great room. Hardwood and tile flooring are featured throughout the home. The bright living room offers plenty of natural light & a cozy gas fireplace. The deluxe kitchen boasts custom maple cabinetry, eat up island, granite countertops, stainless steel appliances with gas stove, convenient walk through pantry, & adjacent dining area with garden door to the backyard. The upper level holds a large bonus room, 3 generous bedrooms, main 4pc bath, & laundry. The luxurious master suite includes a walk in closet & 5pc ensuite with separate shower & soaker tub. The basement is fully developed with in floor heating, huge family & rec room, sleek murphy bed, & 3pc bath. Additional features include soundproofing between bedrooms, central air, Sonos speakers, & relaxing hot tub. Situated in a cul-de-sac conveniently close to parks and all amenities."
1908 Tanager Place,Edmonton,T5S 0N3,Starling,AB,3,3,2,1,"$379,900",-1.0,1385,2018,10/6/2021,"NO CONDO FEES! fully upgraded half duplex in the community of Starling. This 3 bedroom, open concept floor plan features 9 ft ceilings and is in immaculate condition. True pride in ownership shines throughout this property. As you walk in the front door, you are met with a spacious foyer leading upstairs to the main floor. Huge windows flood the house with natural light. In the kitchen you will find gorgeous quartz countertops, pots and pan drawers, stainless appliances with a gas stove and soft close drawers! Spindle railing throughout leading upstairs to the spacious 3 bedrooms. The master retreat offers a nice ensuite with a walk in glass shower and a large walk in closet. There is a custom deck built off the kitchen with a staircase leading down to the backyard. An additional storage room is located under the stairwell. Central A/C throughout and a bbq gas line located on the deck.Tandem style 2 car garage is drywalled and has a gas hook up for heat. Located next to St Albert and just off the Henday!"
58 Greenfield Crescent,Fort Saskatchewan,T8L 4P8,South Fort,AB,5,6,4,2,"$999,999",17496.93,2790,2007,10/6/2021,"Exquisite executive home on 1/2 acre lot backing on to green space. Boasting over 4600 sq ft this 5 bed 6 bath home has appointments that will please the most discerning buyer. Step into the grand front entry & be greeted by 19 ft ceilings & reclaimed floors. The old world kitchen leads to a covered deck adding over 800 sq ft of outdoor living space ideal for entertaining. The master has a luxury 6 pce bath w/ jacuzzi clawfoot tub, multi head shower & His & her closets. A den with fireplace works well as a home office. 2 generous bedrms with walk in closets & full ensuite baths & family rm completes the upper level. The walkout offers 2 more bedrms, a gym, wine rm, play rm, family rm & full 2nd kitchen. High efficiency Zoned heating, central vac, 42x22 garage w/ A/C & its own bathrm, new stone aggregate driveway, underground sprinkler system, architecturally landscaped yard, RV parking, hot tub, heaters on the patio & deck, the list goes on & on. Homes of this calibre rarely come along. A must see home!"
14830 103 Avenue,Edmonton,T5N 0V1,Grovenor,AB,3,3,2,1,"$479,900",2653.3,1388,2015,10/6/2021,"Super unique half duplex with an attached garage, roof top patio, and forced walk out basement! This property offers three bedrooms, two and a half bathrooms, hardwood and tile floors throughout! The main floor is open concept with a white kitchen and stainless appliances. Upstairs the bedrooms are a good size and there is a balcony off of the master bedroom and a huge master ensuite. On the top floor is a massive roof top patio. Downstairs is unfinished, and has a forced walk out entrance perfect for a home business or potentail future secondary suite (based on City of Edmonton approval). Rare infill homes with attached garages don't come up for sale very often. Don't miss out!"
3012 Kostash Crest,Edmonton,T6W 1A5,Keswick Area,AB,6,4,4,-1,"$879,900",4767.55,2842,2021,10/6/2021,WELCOME to the beautiful community of one at Keswick. this beautiful 2-story has each and every upgrade you can think of. Appealing exterior finish with acrylic stucco and exposed aggregate driveway. fully finished oversize double garage comes with centre drain. Main floor covered with marble look oversize porcelain tiles. upon entrance you will find a bedroom and full bath. Mudroom Leeds to walkthrough chef kitchen. and then you find highly upgraded main kitchen with built in appliances and double fridge. the open concept and 20 ft high open to above ceiling with over size windows make family area the best place to spend your whole day. stairs with glass railings leads you the second floor
3118 Chokecherry Bend,Edmonton,T6X 2M2,The Orchards At Ellerslie,AB,6,4,3,1,"$595,000",3241.33,2375,2019,10/6/2021,"What's better than a new home? A new home w/ nothing to do except customize your deck/patio! Welcome to this gorgeous home in the family friendly neighbourhood of The Orchards offering clubhouse priviledges for those in the community. Built with longevity & pride at almost 2,400 SF, this home was completed for families with families in mind. Soaring 9' ceiling w/ bright, modern finishes, the chef's kitchen is finished w/ the granite counters, upgraded cabinetry to the ceiling & lengthy island w/ undermount sink. High end appliances provide even more functionality. A spacious den is around the corner from the cozy LR heated by an electric F/P. Upstairs, past the laundry room, coffered ceilings & pot lights surround the bonus room & carry into the primary that's 5pc ensuite features an elegant soaker tub & enclosed toilet room. The basement hosts a separate space w/ separate entrance, professionally completed with 2 add'l rooms & wet bar. Dual furnace, soundproof/fire res. insulation & much more to list!"
24 Lakewood Cove,Spruce Grove,T7X 4L1,Lakewood_Spgr,AB,4,4,3,1,"$439,900",3896.53,1945,2007,10/6/2021,"The wonderful community of Lakewood in Spruce Grove is where this newer 2-storey home is located. Soaring ceilings, and bright windows, letting light pour through, greet you as you step in through the front entrance. Walk through to the open concept living, dining and kitchen area, with hardwood floors throughout, and a gas fireplace to keep things cozy. In the kitchen you will find dark cabinetry, pantry, loads of cupboard space and nearby access to the large north -facing deck. Dedicated laundry room, 2-piece bathroom and access to the double attached garage complete the main floor.  Upstairs: Primary bedroom with large 5-piece ensuite and walk-in closet, two additional bedrooms and 4-piece bathroom. On the lower level: large family room, 4th bedroom and 4-piece bathroom. Outside you'll find an oasis! Large deck, fully fenced yard, mature trees, garden beds and storage shed. Close to everything and great for commuters. Move in ready!"
43 Waverley Crescent,Spruce Grove,T7X 1N8,Woodhaven_Spgr,AB,6,3,3,-1,"$396,000",8977.09,1321,1975,10/6/2021,"This 4-level split home has over 2400sf of developed living space and is set on a HUGE LOT. Located in the mature neighbourhood of Woodhaven in Spruce Grove, you are surrounded by beautiful trees and close to schools, highway access and parks. Large windows in the living room draw light through to the dining room and lead to the country inspired kitchen with plenty of cupboard and counter space and nearby access to the north-facing deck. A few steps up you'll find the large primary bedroom w/3-piece ensuite, plus two more bedrooms and a 4-piece bathroom. The family room is bright with day-light level windows and keep warm this winter with the stately wood burning fireplace. On the lower levels there are 3 more bedrooms, and a 4-piece bathroom. Loads of storage and shelving. In the backyard, plenty to enjoy with a spacious two level deck, garden beds, shed for storage and even a greenhouse! Plus, the oversized detached double garage ( 26Wx24L) with back alley access. Great opportunity!"
